{
  "eventId": "3fa85f64-5717-4562-b3fc-2c963f66afa6",
  "eventType": "pedido.criado",
  "schemaVersion": 1,
  "aggregateId": "ord_01JABCDEF",
  "aggregateVersion": 0,
  "occurredAt": "2026-09-20T20:10:00Z",
  "correlationId": "3fa85f64-5717-4562-b3fc-2c963f66afa6",
  "causationId": "3fa85f64-5717-4562-b3fc-2c963f66afa6",
  "payload": { "pedidoId": "ord_01JABCDEF" }
}
