{
  "eventId": "8b1e6f3a-2c4d-4e5f-9a0b-1c2d3e4f5a6b",
  "eventType": "payment.status_changed",
  "schemaVersion": 1,
  "aggregateId": "5d6e7f80-1a2b-4c3d-8e9f-0a1b2c3d4e5f",
  "aggregateVersion": 3,
  "occurredAt": "2026-09-24T12:05:00Z",
  "correlationId": "7d0c1c5e-6f4a-4d43-8a51-3f3a1f8b2e10",
  "causationId": "9c8b7a6d-5e4f-4a3b-8c2d-1e0f9a8b7c6d",
  "payload": {
    "paymentIntentId": "5d6e7f80-1a2b-4c3d-8e9f-0a1b2c3d4e5f",
    "orderId": "7d0c1c5e-6f4a-4d43-8a51-3f3a1f8b2e10",
    "from": "AWAITING_PAYMENT",
    "to": "CONFIRMED",
    "reason": null
  }
}
